{
  "schema_version": 1,
  "reporter": "scripts/candidate-status.sh",
  "candidate_path": "/Users/example/.local/state/irin/candidates/0.1.2/aaaaaaaaaaaaaaaaaaaaaaaaaaaaaaaaaaaaaaaa/0123456789abcdef0123456789abcdef0123456789abcdef0123456789abcdef",
  "candidate_id": "0123456789abcdef0123456789abcdef0123456789abcdef0123456789abcdef",
  "source_sha": "aaaaaaaaaaaaaaaaaaaaaaaaaaaaaaaaaaaaaaaa",
  "semver": "0.1.2",
  "pack_mode": "production",
  "dmg_sha256": "bbbbbbbbbbbbbbbbbbbbbbbbbbbbbbbbbbbbbbbbbbbbbbbbbbbbbbbbbbbbbbbb",
  "bundle_manifest_digest": "cccccccccccccccccccccccccccccccccccccccccccccccccccccccccccccccc",
  "well_formed": true,
  "tier": "Accepted",
  "blockers": [
    {
      "code": "missing_publication_proof",
      "message": "proofs/publication.json missing",
      "blocks_tier": "Published"
    }
  ],
  "checks": {
    "identity_ok": true,
    "payload_ok": true,
    "source_on_main": "true",
    "ci_required_green": "true",
    "verify_proof": true,
    "install_proof": true,
    "acceptance_proof": true,
    "publication_proof": false
  },
  "caveats": [
    "Accepted does not cryptographically prove who typed a structurally valid receipt; the human boundary is the operator-controlled T2 action"
  ]
}
